{
  "aggregates": {
    "affix": {
      "conflicting_tables": 2,
      "debt_by_reason": {
        "partial_table_overlap": 3498,
        "repeated_affix_identity": 2,
        "unclassified_source_prose": 5962,
        "unsupported_table_shape": 35
      },
      "parsed_cells": 8060,
      "parsed_tables": 403,
      "semantic_relationships_inferred": false,
      "unsupported_observations": 9495,
      "unsupported_tables": 35
    },
    "debt": {
      "by_reason": {
        "DEBT_CONFLICT": 43,
        "DEBT_INSUFFICIENT_SENSE_EVIDENCE": 8757,
        "DEBT_UNSUPPORTED_SHAPE": 339,
        "chapter_0_toc_unparsed": 1,
        "legacy_debt_not_measured": 2,
        "partial_table_overlap": 3498,
        "prose_and_semantic_exhaustiveness_unmeasured": 14,
        "repeated_affix_identity": 2,
        "roots_without_parsed_senses": 5097,
        "roots_without_parsed_senses_in_source_receipt": 4898,
        "unclassified_source_prose": 5962,
        "unsupported_table_shape": 35
      }
    },
    "grammar": {
      "semantic_exhaustiveness_debt": 1,
      "semantic_exhaustiveness_measured": false,
      "structural_rows": {
        "source_sections": 337,
        "source_table_cells": 5397,
        "source_tables": 324
      }
    },
    "lexicon": {
      "chapters": {
        "0": {
          "evidence": 0,
          "roots": 0,
          "roots_without_parsed_senses": 0,
          "senses": 0
        },
        "1": {
          "evidence": 11,
          "roots": 39,
          "roots_without_parsed_senses": 33,
          "senses": 43
        },
        "2": {
          "evidence": 139,
          "roots": 464,
          "roots_without_parsed_senses": 185,
          "senses": 1572
        },
        "3": {
          "evidence": 228,
          "roots": 122,
          "roots_without_parsed_senses": 94,
          "senses": 100
        },
        "4": {
          "evidence": 2475,
          "roots": 719,
          "roots_without_parsed_senses": 456,
          "senses": 811
        },
        "5": {
          "evidence": 531,
          "roots": 250,
          "roots_without_parsed_senses": 240,
          "senses": 32
        },
        "6": {
          "evidence": 1000,
          "roots": 730,
          "roots_without_parsed_senses": 636,
          "senses": 334
        },
        "7": {
          "evidence": 5104,
          "roots": 3486,
          "roots_without_parsed_senses": 3453,
          "senses": 116
        }
      },
      "evidence": 9488,
      "roots": 5810,
      "roots_without_parsed_senses": 5097,
      "senses": 3008
    },
    "morphology": {
      "affix_degrees": {
        "count": 271,
        "sha256": "dac386ab94a843802e5a1e3152f9502184e9c271fe8df5cd46b0957298c33133"
      },
      "allomorph_rules": {
        "count": 19,
        "sha256": "acb02ad7d6115647b6f9e01b71fb5374e7c3320f51e4a5e7057a648609eddacb"
      },
      "composition_components": {
        "count": 3855,
        "sha256": "0c50d8f3bbce7e8482db1dac93876bfb17b6c3bb21cf6c1147844ea9baa5f396"
      },
      "grammatical_categories": {
        "count": 35,
        "sha256": "c3a192c56e487517a9017314466327e861c4f87651b7dfa5a81390f7c1b968bd"
      },
      "morpheme_compositions": {
        "count": 1917,
        "sha256": "14da797dd47fa9c19de9b3ff1667c507473ea1cd9af1b3e2f87edc464a69721f"
      },
      "morphemes_atomic": {
        "count": 772,
        "sha256": "59da9b999405756e5b571f9454bfe27f0d323218dc05b92e40945189a7ffc628"
      },
      "root_senses": {
        "count": 200,
        "sha256": "b1df2a79fda71df00f06537182fee0283afe0a79060696ec71562e7b38528542"
      },
      "source_assertions": {
        "count": 4709,
        "sha256": "19206fd12725b7fa809ce1bdd036490bc5447937fc93557484a96b5cb5223857"
      }
    },
    "unparsed_artifact_ids": [
      "NI-LEXICON-CURRICULUM:CHAPTER:0",
      "NI-LEXICON-SITE",
      "NI-WEB-INDEX"
    ]
  },
  "claims": {
    "curriculum_admission": false,
    "full_new_ithkuil_coverage": false,
    "semantic_admission": false
  },
  "entries": [
    {
      "artifact_id": "NI-AFFIX-PDF",
      "canonical_rows": {
        "affix_degrees": {
          "count": 0,
          "sha256": "37517e5f3dc66819f61f5a7bb8ace1921282415f10551d2defa5c3eb0985b570"
        },
        "allomorph_rules": {
          "count": 0,
          "sha256": "37517e5f3dc66819f61f5a7bb8ace1921282415f10551d2defa5c3eb0985b570"
        },
        "grammatical_categories": {
          "count": 0,
          "sha256": "37517e5f3dc66819f61f5a7bb8ace1921282415f10551d2defa5c3eb0985b570"
        },
        "morpheme_compositions": {
          "count": 0,
          "sha256": "37517e5f3dc66819f61f5a7bb8ace1921282415f10551d2defa5c3eb0985b570"
        },
        "morphemes_atomic": {
          "count": 0,
          "sha256": "37517e5f3dc66819f61f5a7bb8ace1921282415f10551d2defa5c3eb0985b570"
        },
        "root_senses": {
          "count": 0,
          "sha256": "37517e5f3dc66819f61f5a7bb8ace1921282415f10551d2defa5c3eb0985b570"
        },
        "source_assertions": {
          "count": 0,
          "sha256": "37517e5f3dc66819f61f5a7bb8ace1921282415f10551d2defa5c3eb0985b570"
        },
        "source_table_cells": {
          "count": 8060,
          "sha256": "a72f60f725740ea50c5bbdf565bfc44f7fd50256be62c868d917767be247e9ce"
        },
        "source_tables": {
          "count": 403,
          "sha256": "3a00a7f8fff7b7cc7cb3fcdf7bf5bbca5cc7c357bd38e50960bed6f54ca6bca4"
        }
      },
      "debt_by_reason": {
        "partial_table_overlap": 3498,
        "repeated_affix_identity": 2,
        "unclassified_source_prose": 5962,
        "unsupported_table_shape": 35
      },
      "kind": "affix_reference",
      "last_success_identity": {
        "sha256": "fbb3b0cb2c142580d3c2243884aec6bef3b425c8ad7ff010e83c763b3d9d558d"
      },
      "observed_sha256": "5b758ff4c79ba6ccb6e241e59507f7849a7c470c4b34b431bf546cd028aea3aa",
      "parser": {
        "implementation": "affix_frontier.py",
        "sha256": "2441b5a597c3e2569b7f760b19f8e7bc0b4ee976591c4e298f9614e55a8e687b",
        "structure_parser_sha256": "07d799abba0354ea38075a41de22457aa539bc59842e4ebf86767e11f3c35fd7",
        "version": "1.0.0"
      },
      "pinned_sha256": "5b758ff4c79ba6ccb6e241e59507f7849a7c470c4b34b431bf546cd028aea3aa",
      "scope": "Pinned affix table and text observations; source-only structure, no morphological relations inferred.",
      "source_id": "NI-AFFIX-PDF",
      "source_receipt": {
        "counts": {
          "cells": 8060,
          "observations": 19954,
          "tables": 403
        },
        "dispositions": {
          "CONFLICT": 2,
          "PARSED": 8463,
          "TABLE_COVERED": 1994,
          "UNSUPPORTED": 9495
        },
        "engine": "PyMuPDF",
        "engine_version": "1.27.2.3",
        "inventory": {
          "detected_tables": 440,
          "table_shapes": {
            "10x2": 150,
            "10x3": 9,
            "10x4": 250,
            "10x5": 9,
            "10x6": 2,
            "11x3": 1,
            "11x9": 1,
            "12x4": 1,
            "12x43": 1,
            "14x3": 3,
            "14x4": 2,
            "19x4": 1,
            "2x4": 1,
            "3x2": 1,
            "4x2": 1,
            "6x2": 1,
            "7x4": 1,
            "8x3": 2,
            "8x7": 1,
            "9x2": 2
          }
        },
        "observations_sha256": "230e2c1d5f00fe39cfd7fbfa49a9b00f78c85973bc7918859e24688c2c4db04f",
        "outputs": {
          "source_table_cells.csv": {
            "bytes": 2728012,
            "sha256": "ee2384fa5a917006094106dbdca5d84540271b42cf7841595191c2e4a41d4f8f"
          },
          "source_tables.csv": {
            "bytes": 117962,
            "sha256": "9b3319a69940bf4dbfab086e9de27a7184a933a23331ff588bf9d1a94f3b927a"
          }
        },
        "page_count": 140,
        "parser_sha256": "2441b5a597c3e2569b7f760b19f8e7bc0b4ee976591c4e298f9614e55a8e687b",
        "parser_version": "1.0.0",
        "pdf_format": "PDF 1.3",
        "schema": "ithkuil.affix_frontier.receipt.v1",
        "semantic_relationships_inferred": false,
        "source_bytes": 833483,
        "source_id": "NI-AFFIX-PDF",
        "source_pdf": "newithkuil_affixes.pdf",
        "source_sha256": "5b758ff4c79ba6ccb6e241e59507f7849a7c470c4b34b431bf546cd028aea3aa",
        "source_url": "https://www.ithkuil.net/newithkuil_affixes.pdf",
        "structure_parser_sha256": "07d799abba0354ea38075a41de22457aa539bc59842e4ebf86767e11f3c35fd7",
        "table_dispositions": {
          "CONFLICT": 2,
          "PARSED": 403,
          "UNSUPPORTED": 35
        }
      },
      "status": "PARSED_WITH_DEBT"
    },
    {
      "artifact_id": "NI-LEXICON-CURRICULUM",
      "canonical_rows": {
        "lexicon_root_evidence": {
          "count": 9488,
          "sha256": "9c7952211c91e4c4aae88061e7761d4c4d6c517f811856fead635ede1133cbad"
        },
        "lexicon_root_senses": {
          "count": 3008,
          "sha256": "a2993832be3406c3a354f16c878eb7f2268bfb46066a884348cf3d8e3c7997b9"
        },
        "lexicon_roots": {
          "count": 5810,
          "sha256": "d3a3f93a12754735900506e91c50f7628928810bf3b5059afda0df87794727a8"
        }
      },
      "debt_by_reason": {
        "chapter_0_toc_unparsed": 1,
        "legacy_debt_not_measured": 2
      },
      "kind": "lexicon",
      "last_success_identity": {
        "sha256": "37c5234acdd23edeebc4493f0adad70f2ec67762e91223868b4a731aa1392f03"
      },
      "observed_sha256": "d26d5aabc844ba9cafca68c6e1c7459b0f325e745b919a4aac3e08a61e684a21",
      "parser": {
        "implementation": "build_lexicon_chapters.py + lexicon_frontier.py",
        "legacy_sha256": "44120e04f51d67939a9afb8190101135c37a13a65ed117ad1e7f283c0aaffe4d",
        "sha256": "cbffd5e856816ee5cac0825364bc0d335c5f518571ca1b2708065acee384eae5",
        "version": "1.0.6"
      },
      "pinned_sha256": "d26d5aabc844ba9cafca68c6e1c7459b0f325e745b919a4aac3e08a61e684a21",